<!ELEMENT Vitamins (Vitamin+)>
<!ELEMENT Vitamin (id, name, description)>
<!ELEMENT id (#PCDATA)>
<!ELEMENT name (#PCDATA)>
<!ELEMENT description (#PCDATA)>
